<?xml version="1.0" encoding="UTF-8"?>
<domeMetadata xmlns="https://docs.wto.org/DocumentsOnline-Metadata-Elements-Namespace-v00-03" xmlns:xsi="http://www.w3.org/2001/XMLSchema-instance" xsi:schemaLocation="https://docs.wto.org/DocumentsOnline-Metadata-Elements-Namespace-v00-03 ../../schemas/dol-metadata-v-03.xsd">
  <mdSourceSystem>Documents Online</mdSourceSystem>
  <mdDateCreated>2026-10-15T10:51:17Z</mdDateCreated>
  <mdDateModified>2026-10-15T10:51:17Z</mdDateModified>
  <documentSymbol>WT/TEST/1</documentSymbol>
  <title xml:lang="en">Synthetic</title>
  <originalLanguage>en</originalLanguage>
  <jobID>2026_000001</jobID>
</domeMetadata>
