<?xml version="1.0" encoding="UTF-8"?>
<domeMetadata xmlns="https://docs.wto.org/DocumentsOnline-Metadata-Elements-Namespace-v00-03" xmlns:xsi="http://www.w3.org/2001/XMLSchema-instance" xsi:schemaLocation="https://docs.wto.org/DocumentsOnline-Metadata-Elements-Namespace-v00-03 ../../schemas/dol-metadata-v-03.xsd">
  <mdSourceSystem>Documents Online</mdSourceSystem>
  <mdDateCreated>2026-10-15T13:09:41Z</mdDateCreated>
  <mdDateModified>2026-10-15T13:09:41Z</mdDateModified>
  <documentSymbol>G/TBT/N/EU/1243</documentSymbol>
  <documentType>Notification</documentType>
  <documentNumber>26-6874</documentNumber>
  <documentDate>2026-10-05</documentDate>
  <title xml:lang="en">Committee on Technical Barriers to Trade - Notification - European Union - Biocidal products - Bromoacetic acid </title>
  <title xml:lang="fr">Comité des obstacles techniques au commerce - Notification - Union européenne - Produits biocides - Acide bromoacétique </title>
  <title xml:lang="es">Comité de Obstáculos Técnicos al Comercio - Notificación - Unión Europea - Biocidas - Bromoacetic acid </title>
  <originalLanguage>en</originalLanguage>
  <subject>environmental protection</subject>
  <subject>technical barriers to trade</subject>
  <subject>technical regulations</subject>
  <bodiesIssuing>Committee on Technical Barriers to Trade</bodiesIssuing>
  <countryTerritoryConcerned>European Union</countryTerritoryConcerned>
  <articles>TBT 2.9.2</articles>
  <products>biocidal products</products>
  <status>Original</status>
  <accessRights>Access type: Public; Restriction type: U</accessRights>
  <source>Member</source>
  <version>Final</version>
  <jobID>2026_012405</jobID>
</domeMetadata>
